<?xml version="1.0" encoding="UTF-8"?><employees xmlns:xsi="http://www.w3.org/2001/XMLSchema-instance" xsi:noNamespaceSchemaLocation="C:\VaishaliTemp\WiproXml\XSD Demo\emp.xsd"><employee>			<employeeName>						<fname>Vaishali</fname>						<mname>A</mname>						<lname>Srivastava</lname>			</employeeName>			<empPhone>5576-5565-77477</empPhone>			<age>30</age>			<salary currency="RS">40000</salary></employee>	<employee>			<employeeName>						<fname>Nidhi</fname>						<mname>B</mname>						<lname>Sharma</lname>			</employeeName>			<empPhone>1111-1111-11111</empPhone>			<age>23</age>			<salary currency="RS">20000</salary></employee>			</employees>